{
  "schemaVersion": "golden-path-dependency-report/v2",
  "generatedAt": "2024-01-01T00:11:00Z",
  "observedAt": "2024-01-01T00:10:00Z",
  "observationIdentity": "urn:sha256:bbbbbbbbbbbbbbbbbbbbbbbbbbbbbbbbbbbbbbbbbbbbbbbbbbbbbbbbbbbbbbbb",
  "scope": {
    "organization": "5010-dev",
    "query": "repository=5010-dev/example; Dependabot pull requests and alert lifecycle states"
  },
  "repositories": [
    {
      "repository": "5010-dev/example",
      "defaultBranchSHA": "dddddddddddddddddddddddddddddddddddddddd",
      "applicability": "applicable",
      "classifiedRoots": 1,
      "pendingRoots": 0,
      "routineOpen": 0,
      "securityOpen": 1,
      "openAlerts": 2,
      "openAdvisoryGroups": 1,
      "partiallyLinkedAdvisoryGroups": 1,
      "ownerRoutingCoverage": 1
    }
  ],
  "securityAdvisories": [
    {
      "repository": "5010-dev/example",
      "advisoryIdentity": "GHSA-synthetic-example",
      "ecosystem": "npm",
      "dependency": "example-runtime",
      "remediationCoverage": "partial",
      "openAlertInstances": [
        {
          "number": 9001,
          "severity": "high",
          "relationship": "unknown",
          "manifestPath": "package-lock.json",
          "securityUpdatePullRequest": "https://github.com/5010-dev/example/pull/9001"
        },
        {
          "number": 9002,
          "severity": "high",
          "relationship": "transitive",
          "manifestPath": "packages/worker/package-lock.json"
        }
      ],
      "securityClosureEvidence": [
        {
          "kind": "github-actions-job-run",
          "workflow": ".github/workflows/security-remediation.yml",
          "job": "closure",
          "runId": 1234567890,
          "runAttempt": 1,
          "runUrl": "https://github.com/5010-dev/example/actions/runs/1234567890",
          "headSHA": "aaaaaaaaaaaaaaaaaaaaaaaaaaaaaaaaaaaaaaaa",
          "status": "completed",
          "conclusion": "success",
          "observedAt": "2024-01-01T00:10:00Z"
        }
      ]
    }
  ]
}
